,data.Id2,data.Geography,fit.cluster,statedummy,Color1,10180,"Abilene, TX Metro Area",2,1,#99d8c92,10420,"Akron, OH Metro Area",3,0,#2ca25f3,10500,"Albany, GA Metro Area",2,1,#99d8c94,10580,"Albany-Schenectady-Troy, NY Metro Area",1,1,#e5f5f95,10740,"Albuquerque, NM Metro Area",1,0,#e5f5f96,10780,"Alexandria, LA Metro Area",3,1,#2ca25f7,10900,"Allentown-Bethlehem-Easton, PA-NJ Metro Area",3,1,#2ca25f8,11020,"Altoona, PA Metro Area",3,1,#2ca25f9,11100,"Amarillo, TX Metro Area",2,1,#99d8c910,11180,"Ames, IA Metro Area",2,0,#99d8c911,11260,"Anchorage, AK Metro Area",1,1,#e5f5f912,11300,"Anderson, IN Metro Area",3,1,#2ca25f13,11340,"Anderson, SC Metro Area",3,1,#2ca25f14,11460,"Ann Arbor, MI Metro Area",1,0,#e5f5f915,11500,"Anniston-Oxford, AL Metro Area",3,1,#2ca25f16,11540,"Appleton, WI Metro Area",1,1,#e5f5f917,11700,"Asheville, NC Metro Area",3,1,#2ca25f18,12020,"Athens-Clarke County, GA Metro Area",2,1,#99d8c919,12060,"Atlanta-Sandy Springs-Marietta, GA Metro Area",1,1,#e5f5f920,12100,"Atlantic City-Hammonton, NJ Metro Area",3,1,#2ca25f21,12220,"Auburn-Opelika, AL Metro Area",2,1,#99d8c922,12260,"Augusta-Richmond County, GA-SC Metro Area",2,1,#99d8c923,12420,"Austin-Round Rock, TX Metro Area",1,1,#e5f5f924,12540,"Bakersfield, CA Metro Area",2,0,#99d8c925,12580,"Baltimore-Towson, MD Metro Area",1,1,#e5f5f926,12620,"Bangor, ME Metro Area",3,0,#2ca25f27,12700,"Barnstable Town, MA Metro Area",3,0,#2ca25f28,12940,"Baton Rouge, LA Metro Area",2,1,#99d8c929,12980,"Battle Creek, MI Metro Area",3,0,#2ca25f30,13020,"Bay City, MI Metro Area",3,0,#2ca25f31,13140,"Beaumont-Port Arthur, TX Metro Area",3,1,#2ca25f32,13380,"Bellingham, WA Metro Area",3,0,#2ca25f33,13460,"Bend, OR Metro Area",3,0,#2ca25f34,13740,"Billings, MT Metro Area",3,1,#2ca25f35,13780,"Binghamton, NY Metro Area",3,1,#2ca25f36,13820,"Birmingham-Hoover, AL Metro Area",3,1,#2ca25f37,13900,"Bismarck, ND Metro Area",3,1,#2ca25f38,13980,"Blacksburg-Christiansburg-Radford, VA Metro Area",2,1,#99d8c939,14020,"Bloomington, IN Metro Area",2,1,#99d8c940,14060,"Bloomington-Normal, IL Metro Area",1,0,#e5f5f941,14260,"Boise City-Nampa, ID Metro Area",1,1,#e5f5f942,14460,"Boston-Cambridge-Quincy, MA-NH Metro Area",1,0,#e5f5f943,14500,"Boulder, CO Metro Area",1,0,#e5f5f944,14540,"Bowling Green, KY Metro Area",2,0,#99d8c945,14600,"Bradenton-Sarasota-Venice, FL Metro Area",3,1,#2ca25f46,14740,"Bremerton-Silverdale, WA Metro Area",1,0,#e5f5f947,14860,"Bridgeport-Stamford-Norwalk, CT Metro Area",1,0,#e5f5f948,15180,"Brownsville-Harlingen, TX Metro Area",2,1,#99d8c949,15260,"Brunswick, GA Metro Area",3,1,#2ca25f50,15380,"Buffalo-Niagara Falls, NY Metro Area",3,1,#2ca25f51,15500,"Burlington, NC Metro Area",3,1,#2ca25f52,15540,"Burlington-South Burlington, VT Metro Area",1,0,#e5f5f953,15940,"Canton-Massillon, OH Metro Area",3,0,#2ca25f54,15980,"Cape Coral-Fort Myers, FL Metro Area",3,1,#2ca25f55,16020,"Cape Girardeau-Jackson, MO-IL Metro Area",3,1,#2ca25f56,16180,"Carson City, NV Metro Area",3,0,#2ca25f57,16220,"Casper, WY Metro Area",3,1,#2ca25f58,16300,"Cedar Rapids, IA Metro Area",1,0,#e5f5f959,16580,"Champaign-Urbana, IL Metro Area",2,0,#99d8c960,16620,"Charleston, WV Metro Area",3,1,#2ca25f61,16700,"Charleston-North Charleston-Summerville, SC Metro Area",1,1,#e5f5f962,16740,"Charlotte-Gastonia-Concord, NC-SC Metro Area",1,1,#e5f5f963,16820,"Charlottesville, VA Metro Area",1,1,#e5f5f964,16860,"Chattanooga, TN-GA Metro Area",3,1,#2ca25f65,16940,"Cheyenne, WY Metro Area",3,1,#2ca25f66,16980,"Chicago-Naperville-Joliet, IL-IN-WI Metro Area",1,1,#e5f5f967,17020,"Chico, CA Metro Area",3,0,#2ca25f68,17140,"Cincinnati-Middletown, OH-KY-IN Metro Area",1,1,#e5f5f969,17300,"Clarksville, TN-KY Metro Area",2,1,#99d8c970,17420,"Cleveland, TN Metro Area",3,1,#2ca25f71,17460,"Cleveland-Elyria-Mentor, OH Metro Area",3,0,#2ca25f72,17660,"Coeur d'Alene, ID Metro Area",3,1,#2ca25f73,17780,"College Station-Bryan, TX Metro Area",2,1,#99d8c974,17820,"Colorado Springs, CO Metro Area",1,0,#e5f5f975,17860,"Columbia, MO Metro Area",2,1,#99d8c976,17900,"Columbia, SC Metro Area",1,1,#e5f5f977,17980,"Columbus, GA-AL Metro Area",2,1,#99d8c978,18020,"Columbus, IN Metro Area",3,1,#2ca25f79,18140,"Columbus, OH Metro Area",1,0,#e5f5f980,18580,"Corpus Christi, TX Metro Area",2,1,#99d8c981,18700,"Corvallis, OR Metro Area",2,0,#99d8c982,19060,"Cumberland, MD-WV Metro Area",3,1,#2ca25f83,19100,"Dallas-Fort Worth-Arlington, TX Metro Area",1,1,#e5f5f984,19140,"Dalton, GA Metro Area",2,1,#99d8c985,19180,"Danville, IL Metro Area",3,0,#2ca25f86,19260,"Danville, VA Metro Area",3,1,#2ca25f87,19340,"Davenport-Moline-Rock Island, IA-IL Metro Area",3,0,#2ca25f88,19380,"Dayton, OH Metro Area",3,0,#2ca25f89,19460,"Decatur, AL Metro Area",3,1,#2ca25f90,19500,"Decatur, IL Metro Area",3,0,#2ca25f91,19660,"Deltona-Daytona Beach-Ormond Beach, FL Metro Area",3,1,#2ca25f92,19740,"Denver-Aurora-Broomfield, CO Metro Area",1,0,#e5f5f993,19780,"Des Moines-West Des Moines, IA Metro Area",1,0,#e5f5f994,19820,"Detroit-Warren-Livonia, MI Metro Area",1,0,#e5f5f995,20020,"Dothan, AL Metro Area",3,1,#2ca25f96,20100,"Dover, DE Metro Area",3,1,#2ca25f97,20220,"Dubuque, IA Metro Area",3,0,#2ca25f98,20260,"Duluth, MN-WI Metro Area",3,1,#2ca25f99,20500,"Durham-Chapel Hill, NC Metro Area",1,1,#e5f5f9100,20740,"Eau Claire, WI Metro Area",3,1,#2ca25f101,20940,"El Centro, CA Metro Area",2,0,#99d8c9102,21060,"Elizabethtown, KY Metro Area",3,0,#2ca25f103,21140,"Elkhart-Goshen, IN Metro Area",2,1,#99d8c9104,21300,"Elmira, NY Metro Area",3,1,#2ca25f105,21340,"El Paso, TX Metro Area",2,1,#99d8c9106,21500,"Erie, PA Metro Area",3,1,#2ca25f107,21660,"Eugene-Springfield, OR Metro Area",3,0,#2ca25f108,21780,"Evansville, IN-KY Metro Area",3,1,#2ca25f109,21820,"Fairbanks, AK Metro Area",1,1,#e5f5f9110,22020,"Fargo, ND-MN Metro Area",2,1,#99d8c9111,22140,"Farmington, NM Metro Area",2,0,#99d8c9112,22180,"Fayetteville, NC Metro Area",2,1,#99d8c9113,22220,"Fayetteville-Springdale-Rogers, AR-MO Metro Area",2,1,#99d8c9114,22380,"Flagstaff, AZ Metro Area",2,0,#99d8c9115,22420,"Flint, MI Metro Area",3,0,#2ca25f116,22500,"Florence, SC Metro Area",3,1,#2ca25f117,22520,"Florence-Muscle Shoals, AL Metro Area",3,1,#2ca25f118,22540,"Fond du Lac, WI Metro Area",3,1,#2ca25f119,22660,"Fort Collins-Loveland, CO Metro Area",1,0,#e5f5f9120,22900,"Fort Smith, AR-OK Metro Area",3,1,#2ca25f121,23020,"Fort Walton Beach-Crestview-Destin, FL Metro Area",1,1,#e5f5f9122,23060,"Fort Wayne, IN Metro Area",3,1,#2ca25f123,23420,"Fresno, CA Metro Area",2,0,#99d8c9124,23460,"Gadsden, AL Metro Area",3,1,#2ca25f125,23540,"Gainesville, FL Metro Area",2,1,#99d8c9126,23580,"Gainesville, GA Metro Area",2,1,#99d8c9127,24020,"Glens Falls, NY Metro Area",3,1,#2ca25f128,24140,"Goldsboro, NC Metro Area",2,1,#99d8c9129,24220,"Grand Forks, ND-MN Metro Area",2,1,#99d8c9130,24300,"Grand Junction, CO Metro Area",3,0,#2ca25f131,24340,"Grand Rapids-Wyoming, MI Metro Area",1,0,#e5f5f9132,24500,"Great Falls, MT Metro Area",3,1,#2ca25f133,24540,"Greeley, CO Metro Area",1,0,#e5f5f9134,24580,"Green Bay, WI Metro Area",1,1,#e5f5f9135,24660,"Greensboro-High Point, NC Metro Area",3,1,#2ca25f136,24780,"Greenville, NC Metro Area",2,1,#99d8c9137,24860,"Greenville-Mauldin-Easley, SC Metro Area",3,1,#2ca25f138,25060,"Gulfport-Biloxi, MS Metro Area",3,1,#2ca25f139,25180,"Hagerstown-Martinsburg, MD-WV Metro Area",3,1,#2ca25f140,25260,"Hanford-Corcoran, CA Metro Area",2,0,#99d8c9141,25420,"Harrisburg-Carlisle, PA Metro Area",3,1,#2ca25f142,25500,"Harrisonburg, VA Metro Area",2,1,#99d8c9143,25540,"Hartford-West Hartford-East Hartford, CT Metro Area",1,0,#e5f5f9144,25620,"Hattiesburg, MS Metro Area",2,1,#99d8c9145,25860,"Hickory-Lenoir-Morganton, NC Metro Area",3,1,#2ca25f146,25980,"Hinesville-Fort Stewart, GA Metro Area",2,1,#99d8c9147,26100,"Holland-Grand Haven, MI Metro Area",1,0,#e5f5f9148,26180,"Honolulu, HI Metro Area",1,0,#e5f5f9149,26300,"Hot Springs, AR Metro Area",3,1,#2ca25f150,26380,"Houma-Bayou Cane-Thibodaux, LA Metro Area",2,1,#99d8c9151,26420,"Houston-Sugar Land-Baytown, TX Metro Area",1,1,#e5f5f9152,26580,"Huntington-Ashland, WV-KY-OH Metro Area",3,1,#2ca25f153,26620,"Huntsville, AL Metro Area",1,1,#e5f5f9154,26820,"Idaho Falls, ID Metro Area",2,1,#99d8c9155,26900,"Indianapolis-Carmel, IN Metro Area",1,1,#e5f5f9156,26980,"Iowa City, IA Metro Area",2,0,#99d8c9157,27060,"Ithaca, NY Metro Area",2,1,#99d8c9158,27100,"Jackson, MI Metro Area",3,0,#2ca25f159,27140,"Jackson, MS Metro Area",2,1,#99d8c9160,27180,"Jackson, TN Metro Area",2,1,#99d8c9161,27260,"Jacksonville, FL Metro Area",1,1,#e5f5f9162,27340,"Jacksonville, NC Metro Area",2,1,#99d8c9163,27500,"Janesville, WI Metro Area",3,1,#2ca25f164,27620,"Jefferson City, MO Metro Area",3,1,#2ca25f165,27740,"Johnson City, TN Metro Area",3,1,#2ca25f166,27780,"Johnstown, PA Metro Area",3,1,#2ca25f167,27860,"Jonesboro, AR Metro Area",2,1,#99d8c9168,27900,"Joplin, MO Metro Area",2,1,#99d8c9169,28020,"Kalamazoo-Portage, MI Metro Area",2,0,#99d8c9170,28100,"Kankakee-Bradley, IL Metro Area",3,0,#2ca25f171,28140,"Kansas City, MO-KS Metro Area",1,1,#e5f5f9172,28420,"Kennewick-Pasco-Richland, WA Metro Area",2,0,#99d8c9173,28660,"Killeen-Temple-Fort Hood, TX Metro Area",2,1,#99d8c9174,28700,"Kingsport-Bristol-Bristol, TN-VA Metro Area",3,1,#2ca25f175,28740,"Kingston, NY Metro Area",1,1,#e5f5f9176,28940,"Knoxville, TN Metro Area",3,1,#2ca25f177,29020,"Kokomo, IN Metro Area",3,1,#2ca25f178,29100,"La Crosse, WI-MN Metro Area",3,1,#2ca25f179,29140,"Lafayette, IN Metro Area",2,1,#99d8c9180,29180,"Lafayette, LA Metro Area",2,1,#99d8c9181,29340,"Lake Charles, LA Metro Area",2,1,#99d8c9182,29420,"Lake Havasu City-Kingman, AZ Metro Area",3,0,#2ca25f183,29460,"Lakeland-Winter Haven, FL Metro Area",3,1,#2ca25f184,29540,"Lancaster, PA Metro Area",3,1,#2ca25f185,29620,"Lansing-East Lansing, MI Metro Area",2,0,#99d8c9186,29700,"Laredo, TX Metro Area",2,1,#99d8c9187,29740,"Las Cruces, NM Metro Area",2,0,#99d8c9188,29820,"Las Vegas-Paradise, NV Metro Area",1,0,#e5f5f9189,29940,"Lawrence, KS Metro Area",2,1,#99d8c9190,30020,"Lawton, OK Metro Area",2,1,#99d8c9191,30140,"Lebanon, PA Metro Area",3,1,#2ca25f192,30300,"Lewiston, ID-WA Metro Area",3,1,#2ca25f193,30340,"Lewiston-Auburn, ME Metro Area",3,0,#2ca25f194,30460,"Lexington-Fayette, KY Metro Area",2,0,#99d8c9195,30620,"Lima, OH Metro Area",3,0,#2ca25f196,30700,"Lincoln, NE Metro Area",2,1,#99d8c9197,30780,"Little Rock-North Little Rock-Conway, AR Metro Area",2,1,#99d8c9198,30860,"Logan, UT-ID Metro Area",2,1,#99d8c9199,30980,"Longview, TX Metro Area",3,1,#2ca25f200,31020,"Longview, WA Metro Area",3,0,#2ca25f201,31100,"Los Angeles-Long Beach-Santa Ana, CA Metro Area",1,0,#e5f5f9202,31140,"Louisville-Jefferson County, KY-IN Metro Area",3,1,#2ca25f203,31180,"Lubbock, TX Metro Area",2,1,#99d8c9204,31340,"Lynchburg, VA Metro Area",3,1,#2ca25f205,31420,"Macon, GA Metro Area",2,1,#99d8c9206,31460,"Madera-Chowchilla, CA Metro Area",2,0,#99d8c9207,31540,"Madison, WI Metro Area",1,1,#e5f5f9208,31700,"Manchester-Nashua, NH Metro Area",1,0,#e5f5f9209,31740,"Manhattan, KS Metro Area",2,1,#99d8c9210,31860,"Mankato-North Mankato, MN Metro Area",2,1,#99d8c9211,31900,"Mansfield, OH Metro Area",3,0,#2ca25f212,32580,"McAllen-Edinburg-Mission, TX Metro Area",2,1,#99d8c9213,32780,"Medford, OR Metro Area",3,0,#2ca25f214,32820,"Memphis, TN-MS-AR Metro Area",2,1,#99d8c9215,32900,"Merced, CA Metro Area",2,0,#99d8c9216,33100,"Miami-Fort Lauderdale-Pompano Beach, FL Metro Area",1,1,#e5f5f9217,33140,"Michigan City-La Porte, IN Metro Area",3,1,#2ca25f218,33260,"Midland, TX Metro Area",2,1,#99d8c9219,33340,"Milwaukee-Waukesha-West Allis, WI Metro Area",1,1,#e5f5f9220,33460,"Minneapolis-St. Paul-Bloomington, MN-WI Metro Area",1,1,#e5f5f9221,33540,"Missoula, MT Metro Area",2,1,#99d8c9222,33660,"Mobile, AL Metro Area",2,1,#99d8c9223,33700,"Modesto, CA Metro Area",2,0,#99d8c9224,33740,"Monroe, LA Metro Area",2,1,#99d8c9225,33780,"Monroe, MI Metro Area",1,0,#e5f5f9226,33860,"Montgomery, AL Metro Area",2,1,#99d8c9227,34060,"Morgantown, WV Metro Area",2,1,#99d8c9228,34100,"Morristown, TN Metro Area",3,1,#2ca25f229,34580,"Mount Vernon-Anacortes, WA Metro Area",3,0,#2ca25f230,34620,"Muncie, IN Metro Area",2,1,#99d8c9231,34740,"Muskegon-Norton Shores, MI Metro Area",3,0,#2ca25f232,34820,"Myrtle Beach-North Myrtle Beach-Conway, SC Metro Area",3,1,#2ca25f233,34900,"Napa, CA Metro Area",1,0,#e5f5f9234,34940,"Naples-Marco Island, FL Metro Area",3,1,#2ca25f235,34980,"Nashville-Davidson--Murfreesboro--Franklin, TN Metro Area",1,1,#e5f5f9236,35300,"New Haven-Milford, CT Metro Area",1,0,#e5f5f9237,35380,"New Orleans-Metairie-Kenner, LA Metro Area",3,1,#2ca25f238,35620,"New York-Northern New Jersey-Long Island, NY-NJ-PA Metro Area",1,1,#e5f5f9239,35660,"Niles-Benton Harbor, MI Metro Area",3,0,#2ca25f240,35980,"Norwich-New London, CT Metro Area",1,0,#e5f5f9241,36100,"Ocala, FL Metro Area",3,1,#2ca25f242,36140,"Ocean City, NJ Metro Area",3,1,#2ca25f243,36220,"Odessa, TX Metro Area",2,1,#99d8c9244,36260,"Ogden-Clearfield, UT Metro Area",1,1,#e5f5f9245,36420,"Oklahoma City, OK Metro Area",2,1,#99d8c9246,36500,"Olympia, WA Metro Area",1,0,#e5f5f9247,36540,"Omaha-Council Bluffs, NE-IA Metro Area",1,1,#e5f5f9248,36740,"Orlando-Kissimmee, FL Metro Area",1,1,#e5f5f9249,36780,"Oshkosh-Neenah, WI Metro Area",3,1,#2ca25f250,36980,"Owensboro, KY Metro Area",3,0,#2ca25f251,37100,"Oxnard-Thousand Oaks-Ventura, CA Metro Area",1,0,#e5f5f9252,37340,"Palm Bay-Melbourne-Titusville, FL Metro Area",3,1,#2ca25f253,37380,"Palm Coast, FL Metro Area",3,1,#2ca25f254,37460,"Panama City-Lynn Haven-Panama City Beach, FL Metro Area",3,1,#2ca25f255,37620,"Parkersburg-Marietta-Vienna, WV-OH Metro Area",3,1,#2ca25f256,37700,"Pascagoula, MS Metro Area",3,1,#2ca25f257,37860,"Pensacola-Ferry Pass-Brent, FL Metro Area",3,1,#2ca25f258,37900,"Peoria, IL Metro Area",3,0,#2ca25f259,37980,"Philadelphia-Camden-Wilmington, PA-NJ-DE-MD Metro Area",1,1,#e5f5f9260,38060,"Phoenix-Mesa-Scottsdale, AZ Metro Area",1,0,#e5f5f9261,38220,"Pine Bluff, AR Metro Area",2,1,#99d8c9262,38300,"Pittsburgh, PA Metro Area",3,1,#2ca25f263,38340,"Pittsfield, MA Metro Area",3,0,#2ca25f264,38540,"Pocatello, ID Metro Area",2,1,#99d8c9265,38860,"Portland-South Portland-Biddeford, ME Metro Area",1,0,#e5f5f9266,38900,"Portland-Vancouver-Beaverton, OR-WA Metro Area",1,0,#e5f5f9267,38940,"Port St. Lucie, FL Metro Area",3,1,#2ca25f268,39100,"Poughkeepsie-Newburgh-Middletown, NY Metro Area",1,1,#e5f5f9269,39140,"Prescott, AZ Metro Area",3,0,#2ca25f270,39300,"Providence-New Bedford-Fall River, RI-MA Metro Area",1,0,#e5f5f9271,39340,"Provo-Orem, UT Metro Area",2,1,#99d8c9272,39380,"Pueblo, CO Metro Area",3,0,#2ca25f273,39460,"Punta Gorda, FL Metro Area",3,1,#2ca25f274,39540,"Racine, WI Metro Area",1,1,#e5f5f9275,39580,"Raleigh-Cary, NC Metro Area",1,1,#e5f5f9276,39660,"Rapid City, SD Metro Area",3,1,#2ca25f277,39740,"Reading, PA Metro Area",3,1,#2ca25f278,39820,"Redding, CA Metro Area",3,0,#2ca25f279,39900,"Reno-Sparks, NV Metro Area",1,0,#e5f5f9280,40060,"Richmond, VA Metro Area",1,1,#e5f5f9281,40140,"Riverside-San Bernardino-Ontario, CA Metro Area",1,0,#e5f5f9282,40220,"Roanoke, VA Metro Area",3,1,#2ca25f283,40340,"Rochester, MN Metro Area",1,1,#e5f5f9284,40380,"Rochester, NY Metro Area",3,1,#2ca25f285,40420,"Rockford, IL Metro Area",3,0,#2ca25f286,40580,"Rocky Mount, NC Metro Area",3,1,#2ca25f287,40660,"Rome, GA Metro Area",2,1,#99d8c9288,40900,"Sacramento--Arden-Arcade--Roseville, CA Metro Area",1,0,#e5f5f9289,40980,"Saginaw-Saginaw Township North, MI Metro Area",3,0,#2ca25f290,41060,"St. Cloud, MN Metro Area",2,1,#99d8c9291,41100,"St. George, UT Metro Area",3,1,#2ca25f292,41140,"St. Joseph, MO-KS Metro Area",3,1,#2ca25f293,41180,"St. Louis, MO-IL Metro Area",1,1,#e5f5f9294,41420,"Salem, OR Metro Area",3,0,#2ca25f295,41500,"Salinas, CA Metro Area",1,0,#e5f5f9296,41540,"Salisbury, MD Metro Area",3,1,#2ca25f297,41620,"Salt Lake City, UT Metro Area",1,1,#e5f5f9298,41660,"San Angelo, TX Metro Area",2,1,#99d8c9299,41700,"San Antonio, TX Metro Area",2,1,#99d8c9300,41740,"San Diego-Carlsbad-San Marcos, CA Metro Area",1,0,#e5f5f9301,41780,"Sandusky, OH Metro Area",3,0,#2ca25f302,41860,"San Francisco-Oakland-Fremont, CA Metro Area",1,0,#e5f5f9303,41940,"San Jose-Sunnyvale-Santa Clara, CA Metro Area",1,0,#e5f5f9304,42020,"San Luis Obispo-Paso Robles, CA Metro Area",3,0,#2ca25f305,42060,"Santa Barbara-Santa Maria-Goleta, CA Metro Area",1,0,#e5f5f9306,42100,"Santa Cruz-Watsonville, CA Metro Area",1,0,#e5f5f9307,42140,"Santa Fe, NM Metro Area",1,0,#e5f5f9308,42220,"Santa Rosa-Petaluma, CA Metro Area",1,0,#e5f5f9309,42340,"Savannah, GA Metro Area",2,1,#99d8c9310,42540,"Scranton--Wilkes-Barre, PA Metro Area",3,1,#2ca25f311,42660,"Seattle-Tacoma-Bellevue, WA Metro Area",1,0,#e5f5f9312,42680,"Sebastian-Vero Beach, FL Metro Area",3,1,#2ca25f313,43100,"Sheboygan, WI Metro Area",3,1,#2ca25f314,43300,"Sherman-Denison, TX Metro Area",3,1,#2ca25f315,43340,"Shreveport-Bossier City, LA Metro Area",2,1,#99d8c9316,43580,"Sioux City, IA-NE-SD Metro Area",3,1,#2ca25f317,43620,"Sioux Falls, SD Metro Area",1,1,#e5f5f9318,43780,"South Bend-Mishawaka, IN-MI Metro Area",3,1,#2ca25f319,43900,"Spartanburg, SC Metro Area",3,1,#2ca25f320,44060,"Spokane, WA Metro Area",3,0,#2ca25f321,44100,"Springfield, IL Metro Area",3,0,#2ca25f322,44140,"Springfield, MA Metro Area",3,0,#2ca25f323,44180,"Springfield, MO Metro Area",3,1,#2ca25f324,44220,"Springfield, OH Metro Area",3,0,#2ca25f325,44300,"State College, PA Metro Area",2,1,#99d8c9326,44700,"Stockton, CA Metro Area",2,0,#99d8c9327,44940,"Sumter, SC Metro Area",2,1,#99d8c9328,45060,"Syracuse, NY Metro Area",3,1,#2ca25f329,45220,"Tallahassee, FL Metro Area",2,1,#99d8c9330,45300,"Tampa-St. Petersburg-Clearwater, FL Metro Area",3,1,#2ca25f331,45460,"Terre Haute, IN Metro Area",3,1,#2ca25f332,45500,"Texarkana, TX-Texarkana, AR Metro Area",3,1,#2ca25f333,45780,"Toledo, OH Metro Area",3,0,#2ca25f334,45820,"Topeka, KS Metro Area",3,1,#2ca25f335,45940,"Trenton-Ewing, NJ Metro Area",1,1,#e5f5f9336,46060,"Tucson, AZ Metro Area",3,0,#2ca25f337,46140,"Tulsa, OK Metro Area",3,1,#2ca25f338,46220,"Tuscaloosa, AL Metro Area",2,1,#99d8c9339,46340,"Tyler, TX Metro Area",3,1,#2ca25f340,46540,"Utica-Rome, NY Metro Area",3,1,#2ca25f341,46660,"Valdosta, GA Metro Area",2,1,#99d8c9342,46700,"Vallejo-Fairfield, CA Metro Area",1,0,#e5f5f9343,47020,"Victoria, TX Metro Area",3,1,#2ca25f344,47220,"Vineland-Millville-Bridgeton, NJ Metro Area",3,1,#2ca25f345,47260,"Virginia Beach-Norfolk-Newport News, VA-NC Metro Area",1,1,#e5f5f9346,47300,"Visalia-Porterville, CA Metro Area",2,0,#99d8c9347,47380,"Waco, TX Metro Area",2,1,#99d8c9348,47580,"Warner Robins, GA Metro Area",1,1,#e5f5f9349,47900,"Washington-Arlington-Alexandria, DC-VA-MD-WV Metro Area",1,1,#e5f5f9350,47940,"Waterloo-Cedar Falls, IA Metro Area",3,0,#2ca25f351,48140,"Wausau, WI Metro Area",3,1,#2ca25f352,48260,"Weirton-Steubenville, WV-OH Metro Area",3,1,#2ca25f353,48300,"Wenatchee-East Wenatchee, WA Metro Area",3,0,#2ca25f354,48540,"Wheeling, WV-OH Metro Area",3,1,#2ca25f355,48620,"Wichita, KS Metro Area",2,1,#99d8c9356,48660,"Wichita Falls, TX Metro Area",2,1,#99d8c9357,48700,"Williamsport, PA Metro Area",3,1,#2ca25f358,48900,"Wilmington, NC Metro Area",3,1,#2ca25f359,49020,"Winchester, VA-WV Metro Area",3,1,#2ca25f360,49180,"Winston-Salem, NC Metro Area",3,1,#2ca25f361,49340,"Worcester, MA Metro Area",1,0,#e5f5f9362,49420,"Yakima, WA Metro Area",2,0,#99d8c9363,49620,"York-Hanover, PA Metro Area",3,1,#2ca25f364,49660,"Youngstown-Warren-Boardman, OH-PA Metro Area",3,1,#2ca25f365,49700,"Yuba City, CA Metro Area",2,0,#99d8c9366,49740,"Yuma, AZ Metro Area",2,0,#99d8c9